{
  "$schema": "./knowledge-model.schema.json",
  "schemaVersion": "2.0.0",
  "modelType": "curriculum-knowledge-model",
  "phase": "Phase 2 — Curriculum Source Analysis & Knowledge Model",
  "status": "source-aligned-baseline",
  "lastValidated": "2026-09-07",
  "identity": {
    "courseId": "programming-ai-2nd-sec",
    "subjectEn": "Programming and Artificial Intelligence",
    "subjectAr": "البرمجة والذكاء الاصطناعي",
    "gradeEn": "Egyptian Baccalaureate — 2nd Year",
    "gradeAr": "البكالوريا المصرية — الصف الثاني الثانوي",
    "canonicalLocale": "en",
    "supportedLocales": [
      "en",
      "ar"
    ],
    "canonicalHierarchy": "Part → Unit → Lesson",
    "lessonIdsAreStable": true
  },
  "sourcePolicy": {
    "structureSource": "official contents pages and lesson headings in all four committed PDFs",
    "objectiveSource": "Learning Objectives blocks in the English and Arabic PDFs; English is canonical for normalized text and Arabic is the localization reference",
    "conceptSource": "Key Concepts blocks plus explicit term definitions where a lesson has no labelled Key Concepts block",
    "pagePolicy": "PDF page ranges are stored for reproducibility; textbook page ranges are stored separately because front matter differs by locale/file.",
    "derivedDataPolicy": "knowledge summaries, cautions, concept IDs, and dependency edges are normalized/curated derivatives and are never treated as verbatim textbook text."
  },
  "sources": [
    {
      "sourceId": "source-en-p1",
      "locale": "en",
      "partCode": "P1",
      "path": "docs/curriculum/english/Programming-ArtificialIntelligence-En-EB-part 1.pdf",
      "sha256": "068e2bf706c7d92fd2483fbbca5d2457a9a430e8a1226fa38908f3fd6990a9b1",
      "pdfPages": 104,
      "contentsPdfPage": 4,
      "contentTextbookPages": [
        4,
        101
      ],
      "title": "Programming and Artificial Intelligence — Part 1",
      "publisher": "Ministry of Education and Technical Education",
      "copyrightYear": "2026/2027"
    },
    {
      "sourceId": "source-en-p2",
      "locale": "en",
      "partCode": "P2",
      "path": "docs/curriculum/english/Programming-ArtificialIntelligence-En-EB-part 2.pdf",
      "sha256": "f61204beb3d25db0d7696558a04e354cef7dcb39d2ead82fff08b6bce2a9192a",
      "pdfPages": 88,
      "contentsPdfPage": 4,
      "contentTextbookPages": [
        4,
        85
      ],
      "title": "Programming and Artificial Intelligence — Part 2",
      "publisher": "Ministry of Education and Technical Education",
      "copyrightYear": "2026/2027"
    },
    {
      "sourceId": "source-ar-p1",
      "locale": "ar",
      "partCode": "P1",
      "path": "docs/curriculum/arabic/Programming-ArtificialIntelligence-Ar-EB-part 1.pdf",
      "sha256": "11675fe5a1ddad6e0da8451dc8412cae02121008ce9dadc918fed5e1a41e352d",
      "pdfPages": 95,
      "contentsPdfPage": 4,
      "contentTextbookPages": [
        4,
        91
      ],
      "title": "البرمجة والذكاء الاصطناعي — الجزء الأول",
      "publisher": "وزارة التربية والتعليم والتعليم الفني",
      "copyrightYear": "2026/2027"
    },
    {
      "sourceId": "source-ar-p2",
      "locale": "ar",
      "partCode": "P2",
      "path": "docs/curriculum/arabic/Programming-ArtificialIntelligence-Ar-EB-part 2.pdf",
      "sha256": "fbad37d73a458e4099ee70eebfd8225ffc09becc4bfd2ea83a2de825d43dc089",
      "pdfPages": 77,
      "contentsPdfPage": 4,
      "contentTextbookPages": [
        4,
        72
      ],
      "title": "البرمجة والذكاء الاصطناعي — الجزء الثاني",
      "publisher": "وزارة التربية والتعليم والتعليم الفني",
      "copyrightYear": "2026/2027"
    }
  ],
  "parts": [
    {
      "id": "part-1",
      "code": "P1",
      "order": 1,
      "title": "Part 1",
      "titleAr": "الجزء الأول",
      "descriptionEn": "Information Technology and Society; Cybersecurity; Web Applications; Web and Media Design.",
      "descriptionAr": "تكنولوجيا المعلومات والمجتمع؛ الأمن السيبراني؛ تطبيقات الويب؛ تصميم الويب والوسائط.",
      "sourceIds": [
        "source-en-p1",
        "source-ar-p1"
      ],
      "units": [
        {
          "id": "unit-1",
          "code": "1",
          "order": 1,
          "title": "Information Technology and Society",
          "titleAr": "تكنولوجيا المعلومات والمجتمع",
          "icon": "Globe",
          "sourceTextbookPages": {
            "english": [
              4,
              32
            ],
            "arabic": [
              4,
              30
            ]
          },
          "lessons": [
            {
              "id": "lesson-1-1",
              "code": "1-1",
              "order": 1,
              "title": "Development of Information Technology and Social Transformation",
              "titleAr": "تطور تكنولوجيا المعلومات والتحول الاجتماعي",
              "sourcePages": {
                "english": {
                  "pdfPages": [
                    5,
                    6,
                    7,
                    8,
                    9,
                    10,
                    11,
                    12
                  ],
                  "textbookPages": [
                    4,
                    5,
                    6,
                    7,
                    8,
                    9,
                    10,
                    11
                  ],
                  "objectivesPdfPage": 5,
                  "conceptEvidencePdfPage": 6
                },
                "arabic": {
                  "pdfPages": [
                    5,
                    6,
                    7,
                    8,
                    9,
                    10,
                    11,
                    12
                  ],
                  "textbookPages": [
                    4,
                    5,
                    6,
                    7,
                    8,
                    9,
                    10,
                    11
                  ],
                  "objectivesPdfPage": 5,
                  "conceptEvidencePdfPage": 6
                }
              },
              "objectives": [
                {
                  "textEn": "Explain the major stages in the development of information technology and their impact on society.",
                  "textAr": "شرح المراحل الرئيسية في تطور تكنولوجيا المعلومات وتأثيرها على المجتمع.",
                  "verb": "explain",
                  "cognitiveLevel": "understand"
                },
                {
                  "textEn": "Give examples of social changes and emerging technologies brought about by information technology, and explain their characteristics.",
                  "textAr": "إعطاء أمثلة على التغيرات الاجتماعية والتقنيات الناشئة التي أحدثتها تكنولوجيا المعلومات، وشرح خصائصها.",
                  "verb": "give examples",
                  "cognitiveLevel": "apply"
                }
              ],
              "knowledgeSummaryEn": "Information technology advances through stages that introduce new capabilities and reshape communication, work, learning, and commerce.",
              "cautionAndMisconceptionsEn": [
                "Do not treat one technology stage as isolated; the lesson connects technical change to social impact."
              ],
              "conceptIds": [
                "concept-moore-s-law",
                "concept-sns",
                "concept-e-commerce",
                "concept-remote-work",
                "concept-online-learning",
                "concept-cashless-payment",
                "concept-edge-computing",
                "concept-autonomous-driving",
                "concept-ar-vr",
                "concept-quantum-computing"
              ]
            },
            {
              "id": "lesson-1-2",
              "code": "1-2",
              "order": 2,
              "title": "How AI Works",
              "titleAr": "كيف يعمل الذكاء الاصطناعي",
              "sourcePages": {
                "english": {
                  "pdfPages": [
                    13,
                    14,
                    15,
                    16,
                    17,
                    18,
                    19
                  ],
                  "textbookPages": [
                    12,
                    13,
                    14,
                    15,
                    16,
                    17,
                    18
                  ],
                  "objectivesPdfPage": 13,
                  "conceptEvidencePdfPage": 14
                },
                "arabic": {
                  "pdfPages": [
                    13,
                    14,
                    15,
                    16,
                    17,
                    18
                  ],
                  "textbookPages": [
                    12,
                    13,
                    14,
                    15,
                    16,
                    17
                  ],
                  "objectivesPdfPage": 13,
                  "conceptEvidencePdfPage": 14
                }
              },
              "objectives": [
                {
                  "textEn": "Explain what AI is.",
                  "textAr": "شرح ماهية الذكاء الاصطناعي.",
                  "verb": "explain",
                  "cognitiveLevel": "understand"
                },
                {
                  "textEn": "Explain how generative AI is positioned within AI technologies.",
                  "textAr": "شرح موقع الذكاء الاصطناعي التوليدي ضمن تقنيات الذكاء الاصطناعي.",
                  "verb": "explain",
                  "cognitiveLevel": "understand"
                }
              ],
              "knowledgeSummaryEn": "AI is the broad field; machine learning is within AI, deep learning is within machine learning, and generative AI is built on deep learning.",
              "cautionAndMisconceptionsEn": [